mysql> #Hii All This is DAY24(12-08-2024) of SQL Learning. Today's topic is Check Constraint,
Query OK, 0 rows affected (0.00 sec)

mysql> show databases;
+--------------------+
| Database           |
+--------------------+
| information_schema |
| mysql              |
| performance_schema |
| stud               |
| student            |
| students           |
| sys                |
+--------------------+
7 rows in set (0.07 sec)

mysql> use students;
Database changed
mysql> show tables;
+--------------------+
| Tables_in_students |
+--------------------+
| con1               |
| school             |
| ss                 |
| std                |
+--------------------+
4 rows in set (0.02 sec)

mysql> create table std1(Admno integer Primary Key,Name char(20) Not Null,Gender char(1),Age integer Check(Age<=19),Place char(10));
Query OK, 0 rows affected (0.06 sec)

mysql>  INSERT INTO std1 (Admno, Name, Gender, Age, Place) VALUES (100,’ Ashish’,’ M’, 17,’ Chennai’);
ERROR 1064 (42000): You have an error in your SQL syntax; check the manual that corresponds to your MySQL server version for the right syntax to use near '? Ashish?,? M?, 17,? Chennai?)' at line 1
mysql>  INSERT INTO std1 (Admno, Name, Gender, Age, Place) VALUES (100,'Ashish','M', '17', 'Chennai');
Query OK, 1 row affected (0.01 sec)

mysql>  INSERT INTO std1 (Admno, Name, Gender, Age, Place) VALUES (101,'Adarsh','M', '20', 'Delhi');
ERROR 3819 (HY000): Check constraint 'std1_chk_1' is violated.
mysql>  INSERT INTO std1 (Admno, Name, Gender, Age, Place) VALUES (101,'Adarsh','M', '20', 'Delhi');
ERROR 3819 (HY000): Check constraint 'std1_chk_1' is violated.
mysql>  INSERT INTO std1 (Admno, Name, Gender, Age, Place) VALUES (101,'Adarsh','M', '19', 'Delhi');
Query OK, 1 row affected (0.00 sec)

mysql> select * from std1;
+-------+--------+--------+------+---------+
| Admno | Name   | Gender | Age  | Place   |
+-------+--------+--------+------+---------+
|   100 | Ashish | M      |   17 | Chennai |
|   101 | Adarsh | M      |   19 | Delhi   |
+-------+--------+--------+------+---------+
2 rows in set (0.00 sec)

mysql> delete from std1 where Admno=101;
Query OK, 1 row affected (0.00 sec)

mysql> select * from std1;
+-------+--------+--------+------+---------+
| Admno | Name   | Gender | Age  | Place   |
+-------+--------+--------+------+---------+
|   100 | Ashish | M      |   17 | Chennai |
+-------+--------+--------+------+---------+
1 row in set (0.00 sec)

mysql> drop tables std1;
Query OK, 0 rows affected (0.02 sec)

mysql> select * from std1;
ERROR 1146 (42S02): Table 'students.std1' doesn't exist
mysql> show tables;
+--------------------+
| Tables_in_students |
+--------------------+
| con1               |
| school             |
| ss                 |
| std                |
+--------------------+
4 rows in set (0.00 sec)

mysql> quit;

















